{"$defs":{"check":{"additionalProperties":false,"properties":{"check_id":{"enum":["STACK_INDEX","STACK_PLATFORM","CHECKPOINT_FILES","CANDIDATE_PEER_EQUALITY","FP8_METADATA","FP8_FINITE_LOGITS","FORMAT_JSON","CONTEXT_1024","CONTEXT_4096","CONTEXT_8192"]},"expected":{"type":["string","integer","boolean"]},"observed":{"type":["string","integer","boolean"]},"ordinal":{"minimum":0,"type":"integer"},"status":{"enum":["PASS","FAIL","NOT_RUN"]}},"required":["ordinal","check_id","expected","observed","status"],"type":"object"},"memory":{"additionalProperties":false,"properties":{"baseline_bytes":{"minimum":0,"type":"integer"},"maximum_reserved_bytes":{"minimum":0,"type":"integer"},"residual_bytes":{"minimum":0,"type":"integer"},"status":{"enum":["PASS","FAIL","NOT_RUN"]}},"required":["baseline_bytes","maximum_reserved_bytes","residual_bytes","status"],"type":"object"},"stack":{"additionalProperties":false,"properties":{"image":{"const":"docker.io/vllm/vllm-openai:v0.10.2"},"index_digest":{"const":"sha256:607442e407b0fea97f8a132a78b787c121a996dd4de181fa08e8da06e71ec2db"},"platform_digest":{"const":"sha256:df2607b26bdda2875de4832f4d08da0055b4b6e3570347f3a849bcc652771dd6"},"status":{"enum":["PASS","FAIL","NOT_RUN"]}},"required":["image","index_digest","platform_digest","status"],"type":"object"}},"$id":"https://moving-origin-research.invalid/schemas/m4-model-preflight-result-v1","$schema":"https://json-schema.org/draft/2020-12/schema","additionalProperties":false,"allOf":[{"if":{"properties":{"status":{"const":"PASS"}},"required":["status"]},"then":{"properties":{"checks":{"maxItems":10,"minItems":10,"prefixItems":[{"properties":{"check_id":{"const":"STACK_INDEX"},"ordinal":{"const":0},"status":{"const":"PASS"}},"required":["ordinal","check_id","status"]},{"properties":{"check_id":{"const":"STACK_PLATFORM"},"ordinal":{"const":1},"status":{"const":"PASS"}},"required":["ordinal","check_id","status"]},{"properties":{"check_id":{"const":"CHECKPOINT_FILES"},"ordinal":{"const":2},"status":{"const":"PASS"}},"required":["ordinal","check_id","status"]},{"properties":{"check_id":{"const":"CANDIDATE_PEER_EQUALITY"},"ordinal":{"const":3},"status":{"const":"PASS"}},"required":["ordinal","check_id","status"]},{"properties":{"check_id":{"const":"FP8_METADATA"},"ordinal":{"const":4},"status":{"const":"PASS"}},"required":["ordinal","check_id","status"]},{"properties":{"check_id":{"const":"FP8_FINITE_LOGITS"},"ordinal":{"const":5},"status":{"const":"PASS"}},"required":["ordinal","check_id","status"]},{"properties":{"check_id":{"const":"FORMAT_JSON"},"ordinal":{"const":6},"status":{"const":"PASS"}},"required":["ordinal","check_id","status"]},{"properties":{"check_id":{"const":"CONTEXT_1024"},"ordinal":{"const":7},"status":{"const":"PASS"}},"required":["ordinal","check_id","status"]},{"properties":{"check_id":{"const":"CONTEXT_4096"},"ordinal":{"const":8},"status":{"const":"PASS"}},"required":["ordinal","check_id","status"]},{"properties":{"check_id":{"const":"CONTEXT_8192"},"ordinal":{"const":9},"status":{"const":"PASS"}},"required":["ordinal","check_id","status"]}]}}}}],"properties":{"checks":{"items":{"$ref":"#/$defs/check"},"maxItems":10,"type":"array"},"co_residency":{"$ref":"#/$defs/memory"},"custody_record_sha256":{"pattern":"^[0-9a-f]{64}$"},"date":{"const":"2026-08-21"},"failure_code":{"anyOf":[{"type":"null"},{"enum":["CONFIGURATION_MISMATCH","STACK_IDENTITY_MISMATCH","CHECKPOINT_IDENTITY_MISMATCH","UNAPPROVED_MODEL_ARTIFACT","LICENSE_NOT_ACCEPTED","QUANTIZATION_FLOOR_VIOLATION","FP8_UNSUPPORTED","NONFINITE_LOGITS","FORMAT_PROBE_FAILURE","RESOURCE_ENVELOPE_EXCEEDED","MEMORY_NOT_RELEASED","SWAP_ORDER_MISMATCH","PEER_PRIVILEGE_LEAK","TRANSCRIPT_DIGEST_MISMATCH","LOCAL_ONLY_CUSTODY_VIOLATION"]}]},"regime":{"const":"B"},"request_sha256":{"pattern":"^[0-9a-f]{64}$"},"schema_version":{"const":"m4-model-preflight-result-v1"},"serving_mode_recommendation":{"enum":["CO_RESIDENT","PHASED_SEQUENTIAL","NONE"]},"stack":{"$ref":"#/$defs/stack"},"status":{"enum":["PASS","FAIL","BLOCKED"]},"swap":{"$ref":"#/$defs/memory"}},"required":["schema_version","date","regime","request_sha256","status","failure_code","stack","custody_record_sha256","checks","co_residency","swap","serving_mode_recommendation"],"title":"M4 sanitized model preflight result v1","type":"object","x-artifact-date":"2026-08-21","x-artifact-regime":"B","x-source-class":"PROPOSED"}
