{"checks":[{"check_id":"STACK_INDEX","expected":"sha256:607442e407b0fea97f8a132a78b787c121a996dd4de181fa08e8da06e71ec2db","observed":"sha256:607442e407b0fea97f8a132a78b787c121a996dd4de181fa08e8da06e71ec2db","ordinal":0,"status":"PASS"},{"check_id":"STACK_PLATFORM","expected":"sha256:df2607b26bdda2875de4832f4d08da0055b4b6e3570347f3a849bcc652771dd6","observed":"sha256:df2607b26bdda2875de4832f4d08da0055b4b6e3570347f3a849bcc652771dd6","ordinal":1,"status":"PASS"},{"check_id":"CHECKPOINT_FILES","expected":true,"observed":true,"ordinal":2,"status":"PASS"},{"check_id":"CANDIDATE_PEER_EQUALITY","expected":true,"observed":true,"ordinal":3,"status":"PASS"},{"check_id":"FP8_METADATA","expected":"E4M3","observed":"E4M3","ordinal":4,"status":"PASS"},{"check_id":"FP8_FINITE_LOGITS","expected":true,"observed":true,"ordinal":5,"status":"PASS"},{"check_id":"FORMAT_JSON","expected":"{\"answer\":\"A\"}","observed":"{\"answer\":\"A\"}","ordinal":6,"status":"PASS"},{"check_id":"CONTEXT_1024","expected":1024,"observed":1024,"ordinal":7,"status":"PASS"},{"check_id":"CONTEXT_4096","expected":4096,"observed":4096,"ordinal":8,"status":"PASS"},{"check_id":"CONTEXT_8192","expected":8192,"observed":8192,"ordinal":9,"status":"PASS"}],"co_residency":{"baseline_bytes":0,"maximum_reserved_bytes":15000000000,"residual_bytes":0,"status":"PASS"},"custody_record_sha256":"0000000000000000000000000000000000000000000000000000000000000000","date":"2026-08-21","failure_code":null,"regime":"B","request_sha256":"0000000000000000000000000000000000000000000000000000000000000000","schema_version":"m4-model-preflight-result-v1","serving_mode_recommendation":"CO_RESIDENT","stack":{"image":"docker.io/vllm/vllm-openai:v0.10.2","index_digest":"sha256:607442e407b0fea97f8a132a78b787c121a996dd4de181fa08e8da06e71ec2db","platform_digest":"sha256:df2607b26bdda2875de4832f4d08da0055b4b6e3570347f3a849bcc652771dd6","status":"PASS"},"status":"PASS","swap":{"baseline_bytes":0,"maximum_reserved_bytes":0,"residual_bytes":0,"status":"PASS"}}
